{
  "schema": "qweld.explanation.v1",
  "id": "A-1_machine_vent_clear_20000009",
  "version": "1.0.0",
  "policyVersion": "1.0",
  "locale": "en",
  "questionRef": {
    "taskId": "A-1"
  },
  "summary": "Keep welder vents and fans unobstructed for cooling.",
  "steps": [
    {
      "title": "1) Identify the hazard",
      "text": "Consider failure modes (bursting wheels, shock, fire, poor electrical return, etc.)."
    },
    {
      "title": "2) Apply the standard",
      "text": "Use manufacturer guidance and applicable standards (OSHA/ANSI/AWS)."
    },
    {
      "title": "3) Perform the correct action",
      "text": "Keep inlet/outlet vents clear of obstructions"
    }
  ],
  "why_not": [
    {
      "choiceId": "A",
      "text": "'Block vents to keep dust out' is unsafe/incorrect for this scenario."
    },
    {
      "choiceId": "B",
      "text": "'Place the machine against a wall to save space' is unsafe/incorrect for this scenario."
    },
    {
      "choiceId": "D",
      "text": "'Cover the fan guard during welding' is unsafe/incorrect for this scenario."
    }
  ],
  "tips": [
    "Memorize the key standard for the topic (e.g., ANSI B7.1 for wheels, OSHA 1910.253 for cylinders).",
    "If in doubt, remove from service and consult the OEM manual."
  ],
  "references": [
    {
      "title": "Manufacturer's manual",
      "publisher": "OEM"
    },
    {
      "title": "Best Practice: Welding Shop Safety",
      "publisher": "Trade"
    }
  ],
  "media": [],
  "audit": {
    "updatedAt": "2025-10-30T07:25:53Z",
    "editor": "sme@qweld"
  }
}