{
  "schema": "qweld.explanation.v1",
  "id": "A-1_cylinder_chain_storage_20000001",
  "version": "1.0.0",
  "policyVersion": "1.0",
  "locale": "ru",
  "questionRef": {
    "taskId": "A-1"
  },
  "summary": "Баллоны хранят вертикально и надёжно фиксируют от опрокидывания.",
  "steps": [
    {
      "title": "1) Определи риск",
      "text": "Какие отказы возможны: разрыв круга, поражение током, пожар, плохой обратный контакт и т. п."
    },
    {
      "title": "2) Примени норму",
      "text": "Сверься с инструкцией производителя и соответствующими стандартами (OSHA/ANSI/AWS)."
    },
    {
      "title": "3) Сделай правильно",
      "text": "Выполни правильное действие из условия вопроса."
    }
  ],
  "why_not": [
    {
      "choiceId": "A",
      "text": "Неверно/небезопасно для данной ситуации."
    },
    {
      "choiceId": "C",
      "text": "Неверно/небезопасно для данной ситуации."
    },
    {
      "choiceId": "D",
      "text": "Неверно/небезопасно для данной ситуации."
    }
  ],
  "tips": [
    "Запомни ключевой стандарт по теме (например, ANSI B7.1 — круги; OSHA 1910.253 — газовые баллоны).",
    "Сомневаешься — снимай с эксплуатации и сверяйся с руководством производителя."
  ],
  "references": [
    {
      "title": "OSHA 1910.253",
      "publisher": "OSHA",
      "section": "Oxygen-fuel gas welding and cutting"
    },
    {
      "title": "CGA P-1",
      "publisher": "CGA"
    },
    {
      "title": "Manufacturer's safety data",
      "publisher": "OEM"
    }
  ],
  "media": [],
  "audit": {
    "updatedAt": "2025-10-30T07:25:53Z",
    "editor": "sme@qweld"
  }
}